status	name	id	url	synonym	translator_category	has_contributor	description	category
released	United States Environmental Protection Agency Airborne Pollutant Exposures Data	infores:us-epa-airborne-pollutant-exposures-data			KP			Information Resource
released	Unified phenotype ontology	infores:upheno	https://obofoundry.org/ontology/upheno.html	uPheno			The uPheno ontology integrates multiple phenotype ontologies into a unified cross-species phenotype ontology.	Information Resource
released	Veterans Association National Drug File (VANDF) (from UMLS)	infores:vandf-umls	https://www.nlm.nih.gov/research/umls/rxnorm/sourcereleasedocs/vandf.html		KP			Information Resource
released	Wikidata	infores:wikidata	https://wikidata.org		KP			Information Resource
released	Wikidata Garbanzo	infores:wikidata-garbanzo	https://query.wikidata.org		KP			Information Resource
released	WikiPathways	infores:wikipathways	https://www.wikipathways.org		KP			Information Resource
released	Xenopus Phenotype Ontology	infores:xpo	https://obofoundry.org/ontology/xpo.html	XPO			XPO represents anatomical, cellular, and gene function phenotypes occurring throughout the development of the African frogs Xenopus laevis and tropicalis.	Information Resource
released	Translator Workflow Runner	infores:workflow-runner	https://smart-api.info/registry?q=0881dd3213e259e00b7f3fccaa164dec		ARA	['Standards Reference Implementation Team']	Translator general purpose workflow runner	
released	WormBase	infores:wormbase	http://www.wormbase.org/		KP			Information Resource
released	Zebrafish anatomy and development ontology	infores:zfa	https://obofoundry.org/ontology/zfa.html	ZFA			A structured controlled vocabulary of the anatomy and development of the Zebrafish	Information Resource
released	Zebrafish Information Network	infores:zfin	https://zfin.org/	ZFIN	KP			Information Resource
released	DDinter	infores:ddinter	ddinter.scbdd.com		KP		DDInter is anopen-access database specific to drug-drug interactions with annotations including mechanism description, risk levels, management strategies, alternative medications, etc. to improve clinical decision-making and patient safety.	Information Resource
released	Ki database	infores:ki-database	https://pdsp.unc.edu/databases/kidb.php	KiDB	KP		The Ki database serves as a data warehouse for published and internally-derived Ki, or affinity, values for a large number of drugs and drug candidates at UNC's Psychoactive Drug Screening Program	Information Resource
released	Community Structure-Activity Resource	infores:community-sar	http://www.csardock.org/	CSAR	KP		CSAR disseminated experimental datasets of crystal structures and binding affinities for diverse protein-ligand complexes	Information Resource
released	Drug Design Data Resource	infores:drug-design	https://drugdesigndata.org/	D3R	KP		The Drug Design Data Resource (D3R) aims to advance the technology of computer-aided drug discovery through the interchange of high quality protein-ligand datasets	Information Resource
released	Adverse Event Open Learning through Universal Standardization (AEOLUS)	infores:aeolus	http://doi.org/10.1038/sdata.2016.26		KP	{'Service Provider'}	A curated and standardized version of FAERS removing duplicate case records, applying standardized vocabularies with drug names mapped to RxNorm concepts and outcomes mapped to SNOMED-CT concepts, and pre-computed summary statistics about drug-outcome relationships for general consumption.	Information Resource
